Date,Company,Role,Round,Interviewer,Type,Went Well,Could Improve,Surprise Question,Vibe,Follow Up Sent,Notes
"2026-04-02","Linear","PM Growth","Phone Screen","Amy Chen (Recruiter)",Behavioral,"Clear explanation of growth metrics work. She liked the PLG examples.","Talked too long on the Acme project — should have been tighter.","Why Linear over other tools companies?",Warm,Yes,"She mentioned team is small and scrappy. Good sign."
"2026-04-04","Notion","Senior PM Platform","Round 1","Jordan Liu (PM)",Product Sense,"Nailed the prioritization question. Connected examples to Notion's use case.","Hesitated on the technical architecture question.","How would you deprecate a feature 2M people use?",Strong,Yes,"Jordan seemed genuinely interested. Asked if I had questions about the team."
"2026-04-08","Retool","Senior PM","Phone Screen","Lisa Park (Recruiter)",Behavioral,"Good energy. Talked about builder persona research.","Should have asked more about their internal tools strategy.","What's your hot take on low-code?",Neutral,Yes,"Standard recruiter screen. Hard to read."
"2026-04-09","Retool","Senior PM","Onsite","Panel (4 people)",Mixed,"Strong product critique exercise. PM lead said my framework was clear.","Got rattled by the surprise whiteboard design challenge.","Design a workflow builder from scratch in 30 minutes.",Mixed,Yes,"3 of 4 interviewers felt warm. The eng director was tough to read."
"2026-04-10","Notion","Senior PM Platform","Round 2","Dana Kim (Eng Manager)",Cross-functional,"Good chemistry. We aligned on build vs. buy tradeoffs.","Could have pushed back more on her hypothetical constraint.","How do you handle a PM-eng disagreement about scope?",Strong,Yes,"Dana asked about my timeline — feels like they're moving fast."
